{
  "schema_version": "m4-preparation-manifest-v1",
  "milestone": "M4",
  "revision": "M4.0",
  "status": "PREPARATION_ONLY",
  "baseline": {
    "main_integration_commit": "eb0f2ebc3d0c0a02802ee1cc395c1e705f8ade42",
    "main_integration_ci": {
      "status": "PASSED",
      "run_id": 31235319084
    },
    "closure_delivery_head": "716c11b9154a1ff3b866b7f64d39b1c6a9039e54",
    "closure_delivery_ci": {
      "status": "PASSED",
      "run_id": 31233977467
    },
    "m3_tag": "m3.1.1-closed",
    "m3_tag_object_oid": "47d975f3e0acda0243ae38d528cb45bd38bf9a5f",
    "m3_tag_target_commit": "eb0f2ebc3d0c0a02802ee1cc395c1e705f8ade42",
    "m3_evidence_tree_git_oid": "b769c14bd3a57f32f7495c5ed777c074c1942cd6",
    "skill_tree_git_oid": "28fbe2bab9be312d022a9102a76952d29657d696"
  },
  "authority": {
    "fresh_execution_authorized": false,
    "fresh_tasks_authorized": false,
    "result_writes_authorized": false,
    "retry_authorized": false,
    "repair_authorized": false,
    "authorization_artifact": null,
    "model_binding_status": "UNBOUND_UNTIL_SEPARATE_AUTHORIZATION"
  },
  "matrix": {
    "domains": [
      "nuclear_engineering",
      "mechanical_engineering",
      "electrical_engineering",
      "automation_control",
      "computer_data",
      "multiphysics"
    ],
    "case_count": 12,
    "ordinary_case_count": 6,
    "adversarial_case_count": 6,
    "arms": [
      "N",
      "F",
      "A1",
      "A2",
      "A3"
    ],
    "arm_count": 5,
    "planned_task_count": 60,
    "tasks_per_domain_batch": 10,
    "batches": [
      {
        "batch_id": "M4-BATCH-NUC",
        "domain": "nuclear_engineering",
        "case_ids": [
          "M4-NUC-A",
          "M4-NUC-B"
        ],
        "task_ids": [
          "M4-NUC-A-F",
          "M4-NUC-B-A1",
          "M4-NUC-A-A1",
          "M4-NUC-B-A3",
          "M4-NUC-A-A2",
          "M4-NUC-B-F",
          "M4-NUC-A-N",
          "M4-NUC-B-A2",
          "M4-NUC-A-A3",
          "M4-NUC-B-N"
        ],
        "planned_task_count": 10,
        "stop_on_infrastructure_or_protocol_failure": true,
        "later_batches_mutable_after_observation": false
      },
      {
        "batch_id": "M4-BATCH-MEC",
        "domain": "mechanical_engineering",
        "case_ids": [
          "M4-MEC-A",
          "M4-MEC-B"
        ],
        "task_ids": [
          "M4-MEC-A-N",
          "M4-MEC-A-A1",
          "M4-MEC-B-F",
          "M4-MEC-A-A3",
          "M4-MEC-B-A3",
          "M4-MEC-B-A1",
          "M4-MEC-B-A2",
          "M4-MEC-A-A2",
          "M4-MEC-A-F",
          "M4-MEC-B-N"
        ],
        "planned_task_count": 10,
        "stop_on_infrastructure_or_protocol_failure": true,
        "later_batches_mutable_after_observation": false
      },
      {
        "batch_id": "M4-BATCH-ELE",
        "domain": "electrical_engineering",
        "case_ids": [
          "M4-ELE-A",
          "M4-ELE-B"
        ],
        "task_ids": [
          "M4-ELE-B-A2",
          "M4-ELE-B-A1",
          "M4-ELE-A-A1",
          "M4-ELE-A-N",
          "M4-ELE-A-F",
          "M4-ELE-B-A3",
          "M4-ELE-B-N",
          "M4-ELE-B-F",
          "M4-ELE-A-A3",
          "M4-ELE-A-A2"
        ],
        "planned_task_count": 10,
        "stop_on_infrastructure_or_protocol_failure": true,
        "later_batches_mutable_after_observation": false
      },
      {
        "batch_id": "M4-BATCH-AUT",
        "domain": "automation_control",
        "case_ids": [
          "M4-AUT-A",
          "M4-AUT-B"
        ],
        "task_ids": [
          "M4-AUT-B-A2",
          "M4-AUT-B-A3",
          "M4-AUT-A-A3",
          "M4-AUT-B-A1",
          "M4-AUT-A-A1",
          "M4-AUT-B-N",
          "M4-AUT-A-A2",
          "M4-AUT-B-F",
          "M4-AUT-A-N",
          "M4-AUT-A-F"
        ],
        "planned_task_count": 10,
        "stop_on_infrastructure_or_protocol_failure": true,
        "later_batches_mutable_after_observation": false
      },
      {
        "batch_id": "M4-BATCH-COM",
        "domain": "computer_data",
        "case_ids": [
          "M4-COM-A",
          "M4-COM-B"
        ],
        "task_ids": [
          "M4-COM-B-F",
          "M4-COM-B-A1",
          "M4-COM-B-A2",
          "M4-COM-A-N",
          "M4-COM-B-N",
          "M4-COM-A-A3",
          "M4-COM-B-A3",
          "M4-COM-A-A2",
          "M4-COM-A-F",
          "M4-COM-A-A1"
        ],
        "planned_task_count": 10,
        "stop_on_infrastructure_or_protocol_failure": true,
        "later_batches_mutable_after_observation": false
      },
      {
        "batch_id": "M4-BATCH-MPH",
        "domain": "multiphysics",
        "case_ids": [
          "M4-MPH-A",
          "M4-MPH-B"
        ],
        "task_ids": [
          "M4-MPH-B-F",
          "M4-MPH-A-N",
          "M4-MPH-A-A2",
          "M4-MPH-A-A1",
          "M4-MPH-A-A3",
          "M4-MPH-B-A2",
          "M4-MPH-A-F",
          "M4-MPH-B-N",
          "M4-MPH-B-A1",
          "M4-MPH-B-A3"
        ],
        "planned_task_count": 10,
        "stop_on_infrastructure_or_protocol_failure": true,
        "later_batches_mutable_after_observation": false
      }
    ]
  },
  "execution_constraints": {
    "exact_model_id": null,
    "model_binding_status": "UNBOUND_UNTIL_SEPARATE_AUTHORIZATION",
    "same_model_across_arms": true,
    "tool_profile_id": "M4-READONLY-RESEARCH-V1",
    "allowed_tool_capabilities": [
      "scholarly_discovery_readonly",
      "citation_metadata_verification_readonly",
      "web_search_readonly"
    ],
    "forbidden_actions": [
      "write_user_files",
      "start_services",
      "download_models",
      "upload_research_materials",
      "execute_experiment_or_simulation",
      "train_or_deploy_models",
      "control_physical_systems"
    ],
    "search_query_budget": 12,
    "input_context_token_ceiling": 32000,
    "output_token_ceiling": 8000,
    "wall_clock_minutes": 20,
    "same_user_input_across_arms": true,
    "same_scoring_contract_across_arms": true,
    "one_independent_context_per_task": true,
    "one_independent_finalization_per_task": true,
    "cross_task_result_visibility": false,
    "same_task_retry_count": 0
  },
  "randomization": {
    "frozen": true,
    "algorithm": "sha256_lexicographic_v1",
    "seed": "m4.0-order-v1",
    "task_order": [
      "M4-ELE-B-A2",
      "M4-ELE-B-A1",
      "M4-MEC-A-N",
      "M4-NUC-A-F",
      "M4-NUC-B-A1",
      "M4-MPH-B-F",
      "M4-MEC-A-A1",
      "M4-COM-B-F",
      "M4-MEC-B-F",
      "M4-ELE-A-A1",
      "M4-NUC-A-A1",
      "M4-ELE-A-N",
      "M4-COM-B-A1",
      "M4-MPH-A-N",
      "M4-MEC-A-A3",
      "M4-AUT-B-A2",
      "M4-MEC-B-A3",
      "M4-AUT-B-A3",
      "M4-MPH-A-A2",
      "M4-ELE-A-F",
      "M4-NUC-B-A3",
      "M4-COM-B-A2",
      "M4-MPH-A-A1",
      "M4-AUT-A-A3",
      "M4-AUT-B-A1",
      "M4-COM-A-N",
      "M4-NUC-A-A2",
      "M4-COM-B-N",
      "M4-COM-A-A3",
      "M4-ELE-B-A3",
      "M4-ELE-B-N",
      "M4-AUT-A-A1",
      "M4-AUT-B-N",
      "M4-NUC-B-F",
      "M4-MPH-A-A3",
      "M4-AUT-A-A2",
      "M4-NUC-A-N",
      "M4-MPH-B-A2",
      "M4-ELE-B-F",
      "M4-MEC-B-A1",
      "M4-MEC-B-A2",
      "M4-COM-B-A3",
      "M4-AUT-B-F",
      "M4-NUC-B-A2",
      "M4-NUC-A-A3",
      "M4-MPH-A-F",
      "M4-COM-A-A2",
      "M4-COM-A-F",
      "M4-MPH-B-N",
      "M4-ELE-A-A3",
      "M4-AUT-A-N",
      "M4-COM-A-A1",
      "M4-MEC-A-A2",
      "M4-MEC-A-F",
      "M4-MPH-B-A1",
      "M4-MEC-B-N",
      "M4-ELE-A-A2",
      "M4-MPH-B-A3",
      "M4-AUT-A-F",
      "M4-NUC-B-N"
    ],
    "blind_mapping": {
      "M4-ELE-B-A2": "M4-J001",
      "M4-ELE-B-A1": "M4-J002",
      "M4-MEC-A-N": "M4-J003",
      "M4-NUC-A-F": "M4-J004",
      "M4-NUC-B-A1": "M4-J005",
      "M4-MPH-B-F": "M4-J006",
      "M4-MEC-A-A1": "M4-J007",
      "M4-COM-B-F": "M4-J008",
      "M4-MEC-B-F": "M4-J009",
      "M4-ELE-A-A1": "M4-J010",
      "M4-NUC-A-A1": "M4-J011",
      "M4-ELE-A-N": "M4-J012",
      "M4-COM-B-A1": "M4-J013",
      "M4-MPH-A-N": "M4-J014",
      "M4-MEC-A-A3": "M4-J015",
      "M4-AUT-B-A2": "M4-J016",
      "M4-MEC-B-A3": "M4-J017",
      "M4-AUT-B-A3": "M4-J018",
      "M4-MPH-A-A2": "M4-J019",
      "M4-ELE-A-F": "M4-J020",
      "M4-NUC-B-A3": "M4-J021",
      "M4-COM-B-A2": "M4-J022",
      "M4-MPH-A-A1": "M4-J023",
      "M4-AUT-A-A3": "M4-J024",
      "M4-AUT-B-A1": "M4-J025",
      "M4-COM-A-N": "M4-J026",
      "M4-NUC-A-A2": "M4-J027",
      "M4-COM-B-N": "M4-J028",
      "M4-COM-A-A3": "M4-J029",
      "M4-ELE-B-A3": "M4-J030",
      "M4-ELE-B-N": "M4-J031",
      "M4-AUT-A-A1": "M4-J032",
      "M4-AUT-B-N": "M4-J033",
      "M4-NUC-B-F": "M4-J034",
      "M4-MPH-A-A3": "M4-J035",
      "M4-AUT-A-A2": "M4-J036",
      "M4-NUC-A-N": "M4-J037",
      "M4-MPH-B-A2": "M4-J038",
      "M4-ELE-B-F": "M4-J039",
      "M4-MEC-B-A1": "M4-J040",
      "M4-MEC-B-A2": "M4-J041",
      "M4-COM-B-A3": "M4-J042",
      "M4-AUT-B-F": "M4-J043",
      "M4-NUC-B-A2": "M4-J044",
      "M4-NUC-A-A3": "M4-J045",
      "M4-MPH-A-F": "M4-J046",
      "M4-COM-A-A2": "M4-J047",
      "M4-COM-A-F": "M4-J048",
      "M4-MPH-B-N": "M4-J049",
      "M4-ELE-A-A3": "M4-J050",
      "M4-AUT-A-N": "M4-J051",
      "M4-COM-A-A1": "M4-J052",
      "M4-MEC-A-A2": "M4-J053",
      "M4-MEC-A-F": "M4-J054",
      "M4-MPH-B-A1": "M4-J055",
      "M4-MEC-B-N": "M4-J056",
      "M4-ELE-A-A2": "M4-J057",
      "M4-MPH-B-A3": "M4-J058",
      "M4-AUT-A-F": "M4-J059",
      "M4-NUC-B-N": "M4-J060"
    },
    "judge_mapping_access_authorized": false
  },
  "artifacts": {
    "evals/m4/cases/automation-control-a.json": {
      "sha256": "a5354e30ff243ad446c3252478182071ac5795db68d16250e34f9b11252d57a5",
      "bytes": 1744,
      "role": "case_input"
    },
    "evals/m4/cases/automation-control-b.json": {
      "sha256": "c966bfa8414976fdef91d530a28783dbd5e3fddd0625d13f1e2a9d295d78ec24",
      "bytes": 2808,
      "role": "case_input"
    },
    "evals/m4/cases/computer-data-a.json": {